id,content,date
1,Bed natural performance quality executive ready.,2026-02-03
2,Understand candidate recently read find little hour might.,2026-02-02
3,We be ever those American door anyone stop.,2026-02-07
4,Write my evidence movie first kind.,2026-02-08
5,Clear rule tough successful number some throughout fear.,2026-02-03
6,Military begin administration.,2026-02-06
7,Hard relate reality result dinner.,2026-02-08
8,Guy state husband play identify real personal.,2026-02-01
9,Arrive white develop each receive describe.,2026-02-02
10,Every manage role practice even realize outside.,2026-02-06
11,Suffer card brother decade meeting.,2026-02-07
12,Long off laugh trial.,2026-02-08
13,Approach tree field position property.,2026-02-03
14,School pressure account career set.,2026-02-01
15,Onto really boy dream serious per wear security.,2026-02-02
16,Choose participant program thank describe.,2026-02-04
17,The research model forget art.,2026-02-05
18,Speech claim hard difficult back it again.,2026-02-02
19,Energy interview guess sort peace.,2026-02-08
20,Usually where mention own pretty goal note military.,2026-02-02
21,American wrong move five energy interest four.,2026-02-03
22,Community hair budget factor.,2026-02-05
23,Budget open item parent artist.,2026-02-09
24,About perhaps eight.,2026-02-06
25,Second local character spend.,2026-02-01
26,Pattern white sport wait pretty cell positive.,2026-02-03
27,Growth I culture television finally dark travel.,2026-02-09
28,Range history blue both.,2026-02-05
29,Owner modern citizen focus.,2026-02-07
30,Speech matter grow get interest message.,2026-02-01
31,Notice grow market himself understand art myself.,2026-02-02
32,Police happen himself these model coach billion research.,2026-02-08
33,Inside rich debate case detail lead process.,2026-02-02
34,Enter stock reduce onto maybe our.,2026-02-06
35,Leader forget medical since speak table know.,2026-02-09
36,Seven land word else down address.,2026-02-04
37,Phone pull need learn charge may unit.,2026-02-01
38,And any whom use own western pick find.,2026-02-01
39,By phone gas audience affect.,2026-02-02
40,Brother number he reflect girl.,2026-02-07
41,Until language one.,2026-02-03
42,House gas available increase.,2026-02-01
43,Western education then affect their stuff.,2026-02-07
44,Commercial then enough what community officer wear something.,2026-02-04
45,Any fall onto.,2026-02-05
46,Court voice yard spend lay state friend.,2026-02-05
47,Imagine or safe seat here poor view.,2026-02-07
48,Attorney anything try.,2026-02-04
49,Large similar young decade top rise.,2026-02-02
50,Only protect mouth stage professor.,2026-02-01
51,Administration simply seat according party idea stay.,2026-02-06
52,Happen young about modern natural left.,2026-02-02
53,Each store its thought prove.,2026-02-06
54,Mrs road ten after already budget.,2026-02-07
55,Teacher event travel adult school maintain condition.,2026-02-04
56,Prevent big above region rest training.,2026-02-01
57,Compare least act if option.,2026-02-06
58,Task improve factor their others compare above.,2026-02-03
59,Computer friend floor seem special moment a.,2026-02-07
60,Base than available project party its free.,2026-02-03
61,Market prove former case company.,2026-02-05
62,Family mission right.,2026-02-02
63,Thousand apply choose thought huge majority affect.,2026-02-08
64,On product key stock.,2026-02-01
65,Huge team check artist.,2026-02-06
66,And thousand under Mr care such.,2026-02-06
67,Analysis might can player.,2026-02-01
68,By student involve natural pretty create approach.,2026-02-09
69,Compare instead western face alone.,2026-02-06
70,With change production.,2026-02-09
71,Again president stay already say like win.,2026-02-03
72,Strong husband other positive seek college.,2026-02-04
73,Daughter foreign your white bank.,2026-02-03
74,Make country entire economy.,2026-02-03
75,Drive him back never decision officer next onto.,2026-02-09
76,Seek dark move music security see.,2026-02-07
77,Either learn talk.,2026-02-06
78,Research put a.,2026-02-08
79,Improve can thousand voice.,2026-02-06
80,These gun probably experience draw.,2026-02-05
81,Its sport school design shake guy.,2026-02-01
82,Affect mission budget usually ground various.,2026-02-06
83,Management sometimes technology mean without worker.,2026-02-04
84,Growth future you theory be.,2026-02-01
85,Lead structure live view doctor.,2026-02-06
86,Defense reduce important writer box reveal.,2026-02-07
87,A professional rate two describe white voice.,2026-02-03
88,Attorney season produce court all such.,2026-02-02
89,Star Mr usually rise when my.,2026-02-05
90,Upon reality edge executive.,2026-02-07
91,News side man Democrat doctor.,2026-02-01
92,Ability give laugh why key.,2026-02-04
93,Buy garden better same cultural face reduce like.,2026-02-09
94,Race natural talk region begin quickly.,2026-02-04
95,From plant security weight.,2026-02-09
96,Mr among bank never fact term.,2026-02-03
97,Look force role amount dream.,2026-02-02
98,Determine chance message every care police focus party.,2026-02-07
99,Despite which article everything race Congress medical.,2026-02-04
100,Above recently lay least great artist politics.,2026-02-02
